bussiness_id,stars,text,date,uid
116739,4.0,start tender calamari,2016-05-07 01:36:53,11
116739,4.0,although marinara sauc bit bland touch salt made right,2016-05-07 01:36:53,11
116739,4.0,husband veal pepper said delici tender,2016-05-07 01:36:53,11
116739,4.0,mash potato perfect,2016-05-07 01:36:53,11
116739,4.0,salmon diablo also delici,2016-05-07 01:36:53,11
116739,4.0,salad beauti,2016-05-07 01:36:53,11
116739,4.0,dress serv salad nice amount,2016-05-07 01:36:53,11
116739,4.0,end delici meal piec tiramisu,2016-05-07 01:36:53,11
116739,4.0,server matt right,2016-05-07 01:36:53,11
116739,4.0,pleasant knowledg menu,2016-05-07 01:36:53,11
116739,4.0,appet salad entre time perfectli,2016-05-07 01:36:53,11
116739,4.0,love salad not mind entre serv still eat,2016-05-07 01:36:53,11
116739,4.0,no problem let dinner cool right temp eat comfort,2016-05-07 01:36:53,11
116739,4.0,wonder sometim peopl dont appreci relax take time eat wonder beauti prepar meal,2016-05-07 01:36:53,11
116739,4.0,wonder atmospher,2016-05-07 01:36:53,11
116739,4.0,relax,2016-05-07 01:36:53,11
116739,4.0,chair super comfort,2016-05-07 01:36:53,11
116739,4.0,certainli back,2016-05-07 01:36:53,11
116739,4.0,give tri,2016-05-07 01:36:53,11
116739,4.0,dont alway go review,2016-05-07 01:36:53,11
116739,4.0,bottl riesl calamari app two delici entre dessert 92,2016-05-07 01:36:53,11
116739,4.0,well,2016-05-07 01:36:53,11
12722,4.0,michael red carpet vip amaz,2018-04-27 20:25:26,12
12722,4.0,reach need help plan soon sister law bachelorett,2018-04-27 20:25:26,12
12722,4.0,group 10 girl littl overwhelm michael save day,2018-04-27 20:25:26,12
12722,4.0,everyth super smooth easi,2018-04-27 20:25:26,12
12722,4.0,got good deal best time ever,2018-04-27 20:25:26,12
12722,4.0,book hotel bachelorett packag great price,2018-04-27 20:25:26,12
12722,4.0,save contact info sure reach next vega trip,2018-04-27 20:25:26,12
12722,4.0,,2018-04-27 20:25:26,12
185188,1.0,cannot believ thing chang 3 year,2012-07-16 00:37:14,13
185188,1.0,pick duck conge sometim winter hubbi sick,2012-07-16 00:37:14,13
185188,1.0,disappoint ginger fish sauc tast like gone bad never bitter,2012-07-16 00:37:14,13
185188,1.0,today hubbi want eat sinc crave duck conge place dont serv duck coleslaw side,2012-07-16 00:37:14,13
185188,1.0,wait 10 minut get menu,2012-07-16 00:37:14,13
185188,1.0,place order wait anoth 5 minut get tea place bring menu,2012-07-16 00:37:14,13
185188,1.0,could go detail gist stori understaf staff slow,2012-07-16 00:37:14,13
185188,1.0,worst part servic,2012-07-16 00:37:14,13
185188,1.0,server make us feel bad ask anyth like took order,2012-07-16 00:37:14,13
185188,1.0,arriv place order anoth coupl bside us least 10 minut ahead somehow coupl receiv pho mine,2012-07-16 00:37:14,13
185188,1.0,almost done eat pho mine came,2012-07-16 00:37:14,13
10013,5.0,cant realli find anyth wrong place pasta pizza amaz high qualiti price reason owner staff friendli your downtown check place lot peopl think downtown lot option around that not alway case also lot poor qualiti food downtown well,2017-04-07 21:27:49,14
14110,4.0,great lunch today,2015-01-03 22:47:34,15
14110,4.0,staff help assist select knowledg ingredi,2015-01-03 22:47:34,15
14110,4.0,enjoy bbq chicken tika masala sauc realli good naan bread,2015-01-03 22:47:34,15
14110,4.0,biryani chicken also yummi,2015-01-03 22:47:34,15
14110,4.0,fun see food prepar tandoori oven,2015-01-03 22:47:34,15
14110,4.0,great addit fast casual scene cleveland,2015-01-03 22:47:34,15
33304,5.0,weve huge slim fan sinc open one texa two year ago use live,2017-05-26 01:23:19,16
33304,5.0,place never disappoint,2017-05-26 01:23:19,16
33304,5.0,even great salad grill chicken,2017-05-26 01:23:19,16
33304,5.0,plu fresh brew sweet tea best,2017-05-26 01:23:19,16
97870,3.0,good select class beer main,2014-06-27 21:19:23,17
97870,3.0,ive twice,2014-06-27 21:19:23,17
97870,3.0,first time fri chicken,2014-06-27 21:19:23,17
97870,3.0,delici warn extrem salti,2014-06-27 21:19:23,17
97870,3.0,couldnt even finish last piec chicken experienc salt overload,2014-06-27 21:19:23,17
97870,3.0,second time came wednesday,2014-06-27 21:19:23,17
97870,3.0,didnt know bbq night complet differ menu dont offer anyth origin vegetarianfriendli menu,2014-06-27 21:19:23,17
97870,3.0,menu one vegetarianfriendli option eggplant sandwich,2014-06-27 21:19:23,17
97870,3.0,vegetarian parti said aw,2014-06-27 21:19:23,17
97870,3.0,also bbq night choos 2 side,2014-06-27 21:19:23,17
97870,3.0,except side except 2 fri potato salad,2014-06-27 21:19:23,17
97870,3.0,cant say thrill carb heavi side carb heavi main,2014-06-27 21:19:23,17
97870,3.0,run side earli even,2014-06-27 21:19:23,17
97870,3.0,servic not great,2014-06-27 21:19:23,17
97870,3.0,id avoid come wednesday,2014-06-27 21:19:23,17
33094,4.0,food alway good price reason,2016-01-17 05:26:22,18
33094,4.0,although not exactli restaur like snack bar limit menu walk counter place order wait minut prepar order pay cashier search tabl,2016-01-17 05:26:22,18
33094,4.0,kind like sandwich shop,2016-01-17 05:26:22,18
33094,4.0,still much better choic valu hotel deli strip,2016-01-17 05:26:22,18
64416,5.0,pick meat planet chef make mexican style dish amaz flavor,2016-07-25 03:57:19,19
64416,5.0,wow fish lamb taco die,2016-07-25 03:57:19,19
64416,5.0,drink great well,2016-07-25 03:57:19,19
